tweet_id,tweet_text,class_label
1031487625742364672,"Kerala Floods: We are also making some contributions”, CJI Dipak Misra tells Attorney General  @barandbench #UPCM #UPforKerala #KeralaFloodRelief #KeralaFloods #KeralaReliefFund #KeralaFloods2018 #KeralaFloodsHelpNeeded",rescue_volunteering_or_donation_effort
1030744760170868736,"Come out Bengaluru, Help Kerala, Kodagu In Phase 2 #SOSKerala #SOSKodagu Team is encouraging every Bengalurean to come out of the house &amp; help collect or donate relief material for flood victims. 1) You can JOIN teams active in ur location 2) You can DONATE items required",rescue_volunteering_or_donation_effort
1031946348889698305,#KeralaFloodRelief materials from CII Madurai being unloaded at a warehouse in Trivadrum for distribution to flood affected families. #KeralaFloods @CMOKerala @kris_sg,rescue_volunteering_or_donation_effort
1030834948691742722,RT @RahulEaswar: 29 people dead today inspite of energetic efforts :-( :-( Prayers for those who left us.. #KeralaFloods #KeralaFlood,injured_or_dead_people
1030383801074110464,Over 100 killed in Kerala in just one day as flood crisis worsens #KeralaFloods,injured_or_dead_people
1035232388136108032,@ndtv can youn confirm Rs 5 crore donor for kerala flood relief fund declared by an individual credited to account ? Or it was hoax!,rescue_volunteering_or_donation_effort
1031850431553658880,"10 lakh people are still in relief camps but KJ Alphons goes on prime time TV and says people dont need food or clothes but electricians, plumbers, carpenters. Our very own Marie Antoinette. #KeralaFloodRelief",rescue_volunteering_or_donation_effort
1032627207267594240,"#IndiaPositive This is @narendramodi jis #NewIndia. @MEAIndia has said a polite ‘no’ to offers of foreign assistance to the #Kerala flood victims &amp; said, NRIs, PIOs and foundations can donate to the PM &amp; CM relief funds, however, be welcome. CC @PMOIndia",rescue_volunteering_or_donation_effort
1030890200145125377,"EXTREMELY IMPORTANT! I understand times are tough, but animals require our help too. Please be kind, and rescue + rehabilitate them too. Dont abandon them in times of chaos and stress. They cant fend for themselves. #KeralaFloods #KeralaFloodRelief",rescue_volunteering_or_donation_effort
1032189129059053568,10% CEZ on GST and all these Tax &amp; cost of re building kerala roads and township will again come to flood affected people #Taxation ᾒ6ἿB‍♂️,other_relevant_information
1030741151433650177,People in Kerala are one amongst us. Its our responsibility to support them during their tough times. Since we cant be with them physically lets donate for them  #Donate4Kerala #KeralaFloodRelief #KeralaFloods #Kerala #KeralaSOS #KeralaDonationChallenge,rescue_volunteering_or_donation_effort
1033951155380998145,May allah Bless us to serve for mankind in best way. @humanityfirst #HumanityFirst #KeralaFloods,sympathy_and_support
1032098837190459393,IAS Officers Association of Odisha resolves to contributed minimum one day salary to the relief fund for #KeralaFlood relief efforts. We #StandWithKerala,rescue_volunteering_or_donation_effort
1031762913911025666,How can (WithYou Foundation an NGO)we contribute to victims with food and other requirements from mumbai ..Any leads pls share #KeralaFloods #KeralaFloodsHelpNeeded #StandWithKerala #KeralaFloodRelief #KeralaSOS #KeralaFloods,requests_or_urgent_needs
1037236609907707905,Natural disaster or man-made tragedy of gigantic proportion caused by mishandling of water flow of dams; what is causing concern in Delhi is delay by Kerala Govt in submitting official data abt extent of damages caused in man-made floods,infrastructure_and_utility_damage
1033019278172155905,"@KeralaBlasters It’s easy for a football club like ours to tweet thoughts and prayers from a distance after a catastrophe like the #KeralaFloods, but hopefully next week we can do something more and raise some money that can contribute in a small way to help #RebuildKerala #ForzaKerala",sympathy_and_support
1032137632443056128,"Team @SRKCHENNAIFC Great Job, Working Hard All They Can To Help The People In Need In Kerala. So Proud and #Respect of You Whole Team. @sudhirkothari03 Inspiration from King of Humanity @iamsrk Sir. ὤFἿBὤFἿBὤFἿB #KeralaReliefFund #KeralaFloods #IndiaForKerala #Donate4Kerala",rescue_volunteering_or_donation_effort
1032497689634766849,"Kerala is facing the worst-ever floods in over a century. People have been stranded, displaced and theres a lot that needs to be done. Let us join hands &amp; contribute generously. Heres how you can contribute to the CMs Relief Fund via Zeta. #KeralaFloods #DonateviaZeta",rescue_volunteering_or_donation_effort
1030857730901200896,#Repost @a_kashmir • • • • • NEWS / NOTICIAS Pray For KeralaὤF #kerala #floods #onu #mundo #rinfomundial #noticias #buenosdias #world #ayuda #pray #governament #video #rt,sympathy_and_support
1032290690607337473,I wish I could go to Kerala in this time of need. I wouldve cooked for my hindu &amp; non muslim brothers even if I didnt have money to donate. I couldve contributed by cooking atleast. #KeralaFloods,rescue_volunteering_or_donation_effort
1032218374367899648,Kerala: Restoration work started at Chalakudy market in Thrissur after a decrease in the water level in the district. #KeralaFloods,other_relevant_information
1034852729066156032,"During the catastrophic flood of 1924, Kerala had only one Dam. Today the state has 82 dams! Our ancestors constructed Dams mainly to prevent any such large scale flood. But they couldnt foresee a catastrophe like M.M Mani, who made those dams water bombs!",infrastructure_and_utility_damage
1032333073679970304,Thank you Unicef for helping us to help the flood victims in Kerala ὤFὉ9 stay tuned for the video on my brother’s YouTube channel: @mo_vlogs_,sympathy_and_support
1030396224220930048,How a Madrasa in Kozhikode Turned into a Shelter for 400 Kerala Flood Victims. Thank you @theotherbose for the story.,rescue_volunteering_or_donation_effort
1035847904890679297,Tweeps Kerala people need our help so please let show some support #ONGCForKerala,sympathy_and_support
1030755725524393984,RT @vinayaravind: New list of rescue numbers for Chengannur #KeralaFloods #KeralaSOS,rescue_volunteering_or_donation_effort
1032104022457516034,"Srijith of Palakad, Kerala sends his heartfelt thanks to people of #Tamil Nadu for their timely support and help during the unprecedented #KeralaFlood #KeralaRains #KeralaFloods #KeralaFloodsRelief",sympathy_and_support
1031117537499467776,"RT @damyantig: Verified, please RT, call, share, as necessary: Drinking water available : 9656694699 #Kottayam #KeralaSOS #Resource",requests_or_urgent_needs
1031081249467555840,Engineering Students Develop Power Banks for Those Unable to Contact Families Due to #Kerala Floods #KeralaFloodRelief #Kerala #KeralaReliefFund #socialinnovation,rescue_volunteering_or_donation_effort
1033776974668300289,"@ravithinkz @NarasingM a few years ago, when 5000+ Hindus died in the floods of uttarakhand, many Communists &amp; Islamists laughed and said it was good Hindus were dying. But now during #KeralaFloods, some opportunists from the same camp are trying to act like they are some innocent victims. sad &amp; petty",injured_or_dead_people
1031420107866742785,"#Assam Chief Minister #SarbanandaSonowal on Sunday said his state would give Rs 3 crore aid to rain-ravaged #Kerala, where 210 have died in the last 10 days. #KeralaFloods #KeralaReliefFund",rescue_volunteering_or_donation_effort
1032956212172615680,#KeralaFloods: Is #Keralas Chief Minister @vijayanpinarayi misusing the Chief Ministers Distress Relief Fund (CMDRF)? #KeralaReliefRowTwist This story by #MyNations @PratibaRaman will force you to put your thinking cap on.,rescue_volunteering_or_donation_effort
1033568818113785861,Indian #Telecom Service Officers (ITS) will contribute minimum one-day salary to Prime Ministers relief fund to help flood-affected people in #Kerala. #KeralaFloodRelief #KeralaFloods,rescue_volunteering_or_donation_effort
1032306283288834048,"Shame on ppl who spreading lots of superstitions about #KeralaFloods , like extreme flood going in kerala due to cow was killed in kerala  it is natural disaster ppl should nt undertake it with religion base #india #KeralaFloodRelief..!!",not_humanitarian
1034817078304235522,"@Kickass_monk @rajanandbjp @ProudHI31956314 How dare you compare Shitty RSS with The Great Indian Army? If RSS had actually did Flood Relief in Kerala, why they had to circulate fake photos? Isn’t it proves RSS as biggest Liars?",not_humanitarian
1030779586152423424,"@Pontifex Amen Everyone please pray for the people suffering from the flood hit kerala, India. A whole state needs all of your prayers. People from all over the world are coming up with help and support. Please your prayers will make a difference #KeralaFloods #KeralaFloodRelief",sympathy_and_support
1030396067374755841,"#Keralafloods #Emergency Need urgent help. Genuine, verified. Location: Sri. Ayyappa College Hostel. Near Thiruvanchoor temple. #Chengannur 31 girls - Students stranded. Mob: +91 70254 38808",requests_or_urgent_needs
1036988760863502336,RT @lalita_insan: #DisasterReliefCampsByStMSG Recently a team of Green S volunteers sent to Kerala for giving service to victims of flood.,rescue_volunteering_or_donation_effort
1036147845588348928,Why does Kerala CM Vijayan hv to go to US for medical treatment; arent Indian doctors good enough; arent world class facilities available in many parts of country;flood ravaged State cd hv saved much needed cash for rehabilitation of its ppl @PMOIndia,sympathy_and_support
1032561191724273664,Learn #Modi #Kerala #Population. #Hindu- 54.73% #Muslims- 26.56% #Christians- 18.38% #KeralaFloods #Relief #funds: #UAE ( #Muslim) Country: 700 Crore #Qatar(Muslim) #Country: 36 Crore #Modi #Govt. : 500 Crore #Humanity more imp than #Religion #ModiFail - #NishantVarma,other_relevant_information
1034699845515321344,"Kerala Flood Relief Measures,CREDAI -MCHI came in Support",sympathy_and_support
1034760055864713216,"#Kerala CM inaugurating statelevel reception to honour Fishermen who were part of #Keralafloods rescue operations, at #Trivandrum",rescue_volunteering_or_donation_effort
1033603700546187266,Art show pays tribute to legendary actress #Savitri and donates proceeds to victims of #KeralaFloods ?,rescue_volunteering_or_donation_effort
1030396676349943808,I am all pro-media. But why arent we talking about the floods? Isnt the damage and deaths enough to be talked about? #NationalMedia #KeralaFloods,other_relevant_information
1032219711113707520,"Finally, let us not give any reason to encourage/legitimize ruling class looters like Paytm even in the garb of flood relief and charity. (Btw, that multi-billionaire owner of paytm donated a grand sum of Rs.10,000/- !!) #keralafloods #KeralaReliefFunds Via Sumati",rescue_volunteering_or_donation_effort
1034716880316125185,"#Landslide kills three in #Uttarakhand, five still trapped",injured_or_dead_people
1031237865676582912,"Respect the nature and preserve it. If not, the results are as follows: #KeralaFloods #KashmirFloods #UttarakhandFloods #TheIndianOceanTsunami #GujaratEarthquake #KeralaFloods2018",not_humanitarian
1031067595745587200,"Just like this, many groups of Sikh volunteers are helping people and serving food in flood effected areas. They never waits for the aid from govt, they are always there to help people! More power to them..ὄFὄF #KeralaFloods #KeralaFloodRelief @TajinderBagga",rescue_volunteering_or_donation_effort
1030793329620000769,Kerala Flood Relief 2018 data — a comprehensive list of items required with relief camp details / volunteer network / Emergency Services etc.,rescue_volunteering_or_donation_effort
1030780204011024385,*Urgent help needed !!!* Aunt and family stranded in first floor of house along with 50 other people. One kid passed away one hour ago. Situation is getting worse as water level rises to first floor. #KeralaFloods #KeralaFloodRelief #KeralaSOS @Democratrodrigu @cinemasworld,requests_or_urgent_needs
1031944724431532033,PT medical camp is on ground. The team which has 10 doctors are working hard with the guidance of kerala health dept officials. Our reporters r also helping them in identifying most affected places and people. Appreciate @Stalin__SP @pt_nagarajan @msureshkumar006 @RaghuvaranRU,rescue_volunteering_or_donation_effort
1031751560412295168,RT @ManUtd: The thoughts of everyone at Manchester United are with those affected by the #KeralaFlood. #StandWithKerala,sympathy_and_support
1030802234454421504,"Money donation can be sent to chief minister kerala flood relief account by @exchange_lulu with free charges of transfer and donation of stuff and blankets ,etc in @UniversalHospit in Abudhabi before 19 Aug. #UAEStandsWithKerala #KeralaFloodRelief #KeralaFloods",rescue_volunteering_or_donation_effort
1033270792119758850,"#RSSinAction Hundreds of @RSSorg and #SevaBharati activists are joining for the cleaning and sanitation activities at #Aranmula ,one of the village which was badly affected by #KeralaFloods #KeralaFloodRelief",rescue_volunteering_or_donation_effort
1030802247322460160,"North Wayanad is most hit and isolated. We need kits with these URGENTLY. if you can help, let me know. Ill send you my address which is a collection centre. #KeralaFloodRelief 5kg rice 1kg sugar 250gm tea powder 1/2 kg salt Whole moong (cherupayar) 1 ltr cooking oil.",requests_or_urgent_needs
1032185989920436224,Most of the #KeralaFloods Rescue and Relief work pictures shared by RSS followers and bhakts are either very old or not from Kerala.,rescue_volunteering_or_donation_effort
1035109155273625601,@radiocityindia urged the citizens of Bangalore to donate basic necessities to be sent to relief shelters in Kerala. @KallaKartik @RJVISHWASKAMAT @Umanathv @vijaytvnews4u,rescue_volunteering_or_donation_effort
1031204010605178880,"The death toll in Indias floods-hit southern state of #Kerala has risen to 357, even as rescue and relief work is being carried out on a war footing. Banana and paddy crops spread over 850 acres of land have been destroyed, said unofficial estimates.",injured_or_dead_people
1034753646389391362,"BJP carried out the biggest scam in Indian history, They have more fund their party than what they have given to Kerala as relief. #DemonetisationAScam #KeralaFloods",not_humanitarian
1030786324507308033,Praying for everyone affected by the Kerala floods. #KeralaFloodRelief #LetsHelpKerala,sympathy_and_support
1032475664492847106,"#Kerala, After The Flood: If it was mismanagement in controlling the water from #Idukki dam that sent the #Periyar into #Kochi city, in #Pathanamthitta and Pandanad which saw the deepest of the miseries, it was the sheer failure of an early warning system",other_relevant_information
1031179016483610624,":#Kerala flood toll reaches 370, #RescueOperations continue ..  via @Babushahikhabar",injured_or_dead_people
1033368919325663233,#floods #GlobalWarming #deforestation #KeralaFloodRelief #KodaguFloodRelief @CMOKerala @CMofKarnataka if we continue distracting nature ! Iam sure we will have to implement such precautions for every house from now ! Let’s bring in strict rule to save forest and nature! #letsdoit,other_relevant_information
1032116103831416832,"Food Processing Industries Minister @HarsimratBadal_ speaks to Kerala CM @vijayanpinarayi, seeks inputs on assistance required immediately. #KeralaFloods",rescue_volunteering_or_donation_effort
1032134501378351104,Maruti Suzuki India said today that the company along with its employees will donate Rs 3.5 crore as Kerala flood relief effort. These are corporates @RahulGandhi keep abusing all the time,rescue_volunteering_or_donation_effort
1030811350685999104,Delhi govt to issue advertisements requesting people to donate generously for Chief Minister Relief fund for #KeralaFloods,rescue_volunteering_or_donation_effort
1034759780479320064,Sometimes all it takes is a bit of awareness and precautions! Could the Kerala Floods be predicted? Read our take on this hereὄ9:  #KeralaFloods2018 #KeralaFloods #Kerala,other_relevant_information
1036146490735915009,"#Kerala CM Pinarayi Vijayan leaves for his medical treatment at Mayo clinic (U.S.) early today morning, according to @CMOKerala sources. He was supposed to leave on 19th Aug but postponed that due to the #keralafloods. Wishing him good health.",sympathy_and_support
1032943656888545281,"All those cursing #KeralaFloods due to heavy Rains are wrong, actually, it was a Mass Baptism by God in HeavensHalleluja ὠ7",not_humanitarian
1030412432232075264,17.08.18 4.15 pm Required in #UCCollege #Aluva Gas cylinder with burners and connectors Meals for 4000/- persons Diaper - baby and adult First aid medicine Bedsheet pillows Clothes Water #DoForKerala #KeralaFloods,requests_or_urgent_needs
1031964320920494081,RT @Eddybirdman: Students join hands with TNIE sending supplies to Kerala #KeralaFloodRelief,rescue_volunteering_or_donation_effort
1030729802674712577,PM announces immediate relief of Rs 500 cr to flood-hit Kerala,rescue_volunteering_or_donation_effort
1032116626076954624,"#KeralaFloodRelief Broken compound walls, damaged furniture and water just receding from houses that were completely under the water in #chalakudy in #KeralaFlood #KeralaFloodRescue #KeralaRains |@DeccanHerald",infrastructure_and_utility_damage
1032836335705501697,#KeralaFloods: Husband and wife Dr Rahul KK and Dr Shinu Syamalan have been travelling not only to #reliefcamps but also to private homes to extend medical aid. @CMOKerala @vijayanpinarayi @MoHFW_INDIA @PMOIndia @narendramodi,rescue_volunteering_or_donation_effort
1031030921267298305,"@pratheesh @Plingmyaan 300000 FOOD PCKTS, 600000 MT MILK , 1400000 LTRS OF WATER, 150 PORTABLE WATER PURIFIERS CAPACITY OF 100000 LTR WATERS. WE ALL ARE HAPPY TO SAY UAE IS HELPING OMAN HELPING, BUT NOT READY TO ACCEPT THE FACTS ON GROUND. #KeralaFloodRelief",requests_or_urgent_needs
1032238513146617857,RT @free_thinker: Image of Iraqi Army personnel circulated as Indian army during Kerala flood rescue,rescue_volunteering_or_donation_effort
1033748329132261377,"#BIGNEWS: #Congress President #RahulGandhi to arrive in #Thiruvananthapuram, #Kerala on August 28 to visit flood-hit regions in the state including #Chengannur, #Alappuzha and #Angamaly. He is slated to visit flood-affected areas in #Wayanad on August 29. #KeralaFloods",rescue_volunteering_or_donation_effort
1032941353238495233,Two disasters One is flood another is fake news.. #KeralaFloods,other_relevant_information
1031707034578771978,Bal Swayamsevaks on collection drive for #KeralaFloodRelief camps. Members of Balgokulam tying Rakhies to Army men serving the flood victims.,rescue_volunteering_or_donation_effort
1031083169401921536,"#Xiaomi is supplying thousands of fully charged Mi PowerBanks to relief camps in #Kerala, with help of @CNNnews18. Respect for our team members for charging these powerbanks &amp; helping our countrymen! 1st box being handed over to a volunteer. #XiaomiWithKerala #KeralaFloods",rescue_volunteering_or_donation_effort
1030396221490388992,RT @friendsofrss: #RSSinAction: Some more picture of rescue and relief work in Kerala. #KeralaFloods,rescue_volunteering_or_donation_effort
1031264584575811584,#SRKCFC Team sent relief materials for #KeralaFloods From All Hearts Of SRKian❤ Inspiration from King of Humanity @iamsrk Sir. ὤFἿBὤFἿBὤFἿB #KeralaReliefFund,rescue_volunteering_or_donation_effort
1034709834199957504,What happened in Kerela cannot be described in words! But equally inspiring is the help &amp; support that is pouring in from all sections of society! Great to be part of @NASSCOMfdn &amp; seeking help of flood victims.  &amp;,rescue_volunteering_or_donation_effort
1030385680063459328,RT @tv9gujarati: #Kerala: Death toll due to floods has risen to 167: Kerala CM Pinarayi Vijayan #KeralaFloods,injured_or_dead_people
1033228788354535427,Wink Sensation #PriyaPVarrier has donated ₹ 1 Lakh to #Kerala CMDRF.. #KeralaFloods,rescue_volunteering_or_donation_effort
1035126906562084864,"We know best how destitution and poverty feel.. The residents of govt old age home do pickle making, papad making and mattress-weaving to earn a livelihood. They gave Rs 35,000 to chief ministers disaster relief fund #KeralaFloods2018 #KeralaFloodRelief",rescue_volunteering_or_donation_effort
1033533236364935168,"#KeralaFloods | Government eases lending rules, gives Rs 543 crore as aid to flood-hit Kerala, reports @SaubhadraC",rescue_volunteering_or_donation_effort
1035545951912378368,Really the #100PipersPlayForACause by @100PipersIN is bringing music to play in Gurgaon and Bengaluru to contribute to Kerala flood relief,rescue_volunteering_or_donation_effort
1031458962925920256,No more starving #Hindu”! Keeping this motto we started @HinduHelpline1 in last January and we could successfully serve around30000 families till now and we are capable reaching any where in #Kerala with rice in one hourThis shows the strength of #Hindus if united @Swamy39,rescue_volunteering_or_donation_effort
1030780609038233600,@CMOKerala Hello sir - NEED URGENT ATTENTION- Near malakara temple aranmula pathanamthitta around 300 people starving including kids without food or water .. PLS HELP ON URGENT BASIS ..#KeralaFloods #KeralaFloodRelief,requests_or_urgent_needs
1031851583775166464,#Urgent: Corporate sponsor needed to buy stranded viral medication meant for #KeralaFloodRelief. Please help if you know someone who can take this on.,requests_or_urgent_needs
1032874367489781760,CM Naveen Patnaik announces additional financial assistance of Rs 5 cr for #Kerala from CMRF in addition to 5 cr sanctioned earlier; Naveen also orders that 500 MT of polythene sheets worth about 8 cr to be sent to the flood-ravaged state #KeralaFloods,rescue_volunteering_or_donation_effort
1033771123182391298,"So, theres no such aid of Rs 700 Cr from UAE but theres one Nation who was 1st to send Flood relief items to Kerala without any publicity. That Nation is Israel. Irony is Kerala CM didnt tweet about Israels relief but was busy in tweeting about UAE Fake News Thank You Israel",rescue_volunteering_or_donation_effort
1031071415246540800,RT @igtamil: Vikram donates a whopping amount to Kerala #KeralaFloods,rescue_volunteering_or_donation_effort
1035429730328047616,Advocates donate over Rs.14 lakh towards flood relief #kodagufloodrelief #KeralaFloodRelief,rescue_volunteering_or_donation_effort
1032647473553006592,Are you aware who is incharge and status of red cross society of kerala state.,not_humanitarian
1032932495606468609,#KeralaFloods case: Supreme Court orders to maintain water level at 139.99 feet in Mullaperiyar Dam till August 31.,caution_and_advice
1034734103013154816,#NandamuriHariKrishna Wrote His Last Letter About his Birthday and Requested Fans to Donate Funds to #Kerala victims. Video: #NandamuriHariKrishna #99TVTelugu #RIPHariKrishna #BreakingNews #KeralaFloods,requests_or_urgent_needs
1032459722429878272,"The only CM to have had answered zero questions on disturbing ecology, illegal construction and mining that led to calamity. Not his faultZERO JOURNO asked him any of that. But of course Sri Sris world festival almost had imaginary floods in Delhi.",other_relevant_information
1033270965965185024,"The Ministry of Home Affairs had issued orders designating the MHUA @MoHUA_India as the nodal ministry for urban flooding based on a 2012 @ndmaindia recommendation to address urban flooding as a separate disaster, delinking it from #floods.",infrastructure_and_utility_damage
1036241242806472704,@TimesNow No treatment in Kerala????? 99% literate state dont have to treat him??? This is the problem with communists. They wont allow anything to come up and go abroad on state funds to treat his ailment. Hope he not using the funds collected for flood victims.,not_humanitarian
1031688411692724224,"#MakkalSelvi @KeerthyOfficial Donates ₹ 10 Lakhs to #Kerala CMDRF !!! She along with her parents met the CM and handed over the cheque &amp; also donating relief materials worth ₹ 5 Lakhs (Groceries, Clothes, Medicines etc) to those affected by #KeralaFlood #MakkalSelvi ὤFὤFὤF",rescue_volunteering_or_donation_effort
1034764580835082240,Whats happening on kerala donation for rehabilitation of flood victims .central government has forgotten after giving 600 crores doubt whether amount released .this is not how country is run .can some channel highlight this or aid only goes to BJP states or ads and travel,rescue_volunteering_or_donation_effort
1031204881393053697,"Some bhagwa people busy in #KeralaFloodRelief. Even as Commies say , they dont need Bhagwa help.",sympathy_and_support
1034653208042512384,RT @bijugovind: #KeralaFloodRelief - Aid convoy with #LTTE leader Prabhakaran pictures arrive in #Kerala,rescue_volunteering_or_donation_effort
1032228623233630213,"4,000 relief camps have been opened at various locations to accommodate the flood victims &amp; 3,000 people have been rescued. Kerala needs our help, are you with us? Log on to  and do your bit. #KeralaFloods",rescue_volunteering_or_donation_effort
1033771250269573120,Kerala is facing its worst flood in 100 years. This flood is also one of the worst floods in our countrys history. More than half a million people are displaced. Your help can rebuild the lives of these affected. Donate to:  #KeralaReliefFund,rescue_volunteering_or_donation_effort
1031871413437644801,RT @SteeveArul: Actor Vijay has donated 70 lakhs to #KeralaFloods . #KeralaFloodRelief,rescue_volunteering_or_donation_effort
1036992929410281473,Flood-ravaged Kerala: Deadly ‘rat fever’ kills at least 12 people,injured_or_dead_people
1032588970897682432,"@Ra_THORe for information. Unwept,unhonoured and unsung during Keral floods work",other_relevant_information
