tweet_id,tweet_text,class_label
1030995130814062592,RT @PartyVillage017: Kerala State Muslim League leader visits flood affected zone. ὠ0 #KeralaSOS #KeralaFloods #Donate4Kerala .,rescue_volunteering_or_donation_effort
1032457118249623552,Unloading of food packets at Chengannur. Food packets were brought from Air Force Station Trivandrum in @IAF_MCC Mi17V5 helicopter. #OpKaruna #KeralaFloodRelief @SpokespersonMoD,rescue_volunteering_or_donation_effort
1038339058194415616,"People from all over the country, indeed all over the world have been collecting money and aid for flood ravaged Kerala and in return the two main formations LDF &amp; UDF, @cpimspeak @INCIndia call for a hartal on Monday 10th. Sad day indeed!!",rescue_volunteering_or_donation_effort
1031190500315869184,"@ippatel Sir! I believe you are Hurt with the subject of Cow Slaughter. Sir, What about Goa &amp; North East? Are you praying for Natural disasters there as well. What about BJPians who export beef? You Praying for BJP to get destroyed in 2019? #KeralaReliefFund #KeralaFloods #Meem4Kerala",sympathy_and_support
1033763190293897216,"Free Service Camp was recently conducted at Meveloor, Kerala. The service engineers have repaired 30 pumps in the region and more service engineers will be deployed in other identified areas. #KBLCSR #KeralaFloodRelief #KeralaFloods #KeralaSOS #KirloskarPumps",rescue_volunteering_or_donation_effort
1033770940042072064,Hi Friends and Fans..! Now I’m in Kerala. yesterday i met Honorable Chief Minister of Kerala Shri. Pinarayi Vijayan sir and handed over my donation for flood relief with my mother.. To do more service I need all your blessings..,rescue_volunteering_or_donation_effort
1036970690484686848,"#KeralaFloods #RatFever #Leptospirosis #Health Two of the disease’s latest victims have been identified as Ranju from Ranni in #Idukki and Anil Kumar from Kozhikode, who had actively taken part in cleanup operations after the floods.",other_relevant_information
1032310155793313793,"Moneylife Foundation is one of the most credible organisations where you can safely donate for Kerala Relief Fund. It is sure to go where it should. I ordered several kgs of rice&amp; tur dal via Bigbasket and sent. You too do the same. Come on, lend your helping hand! @suchetadalal",rescue_volunteering_or_donation_effort
1031043988327784448,@tonyfrancis21 @IndianChomsky @pythoroshan @AnooBhu Is this the food camp you are talking about where Lord Ayyappa should go and eat?,not_humanitarian
1030822553277943808,@CMOKerala i am also donating my MLA Salary for this month to the flood affected brothers and sisters of Kerala. This will go to the account Kerala gov. has announced. I appeal to each MLA and MP to contribute at least one month salary like AAP did. @ArvindKejriwal,rescue_volunteering_or_donation_effort
1032622015125970945,Kerala Flood Victims are suffering and its your chance to donate just like @MyTeam_11 did. play and donate. #DilSeViruGiri  @virendersehwag,rescue_volunteering_or_donation_effort
1032953188960227329,Sunny Leone helps 1200 Kg of rice and dal for Kerala floods: #SunnyLeone #Keralafloods #AnushkaSharma #ViratKohli Sunny Leone helps 1200 Kg of rice and dal for Kerala floods,rescue_volunteering_or_donation_effort
1032234147501277184,@CMOKerala Maybe we can get the money via an NGO which is registered to receive foreign funds to cut the Monster in the North who wants to block it. Or maybe we can register an NGO in Dubai for #KeralaFloodRelief and collect all foreign aid to that NGO and then bring it via a local office.,rescue_volunteering_or_donation_effort
1032293956963393536,Abbeh chal hatt. The floods have come because they didn’t let us have the beef and Sanghis exported all of it out of India.,not_humanitarian
1032677355997650944,12 This report says industrialist MA Yusuf Ali owner of #Lulus intervention led to #UAE promising Rs 700 cr flood relief to #Kerala. #AbuDhabi crown prince spoke to PM #NarendraModi and then offered the aid Because of protocol Modi Ji must have mentioned UAE,rescue_volunteering_or_donation_effort
1030408574776762369,Ground report: How Kozhikode Rajeev Nagar residents were rescued as water levels rose #KeralaFloods,rescue_volunteering_or_donation_effort
1032238768420540421,A friend in need is a friend indeed. Israel proves this by helping with much needed relief materials for Kerala.. Thank you @IsraelinIndia @IsraeliPM,rescue_volunteering_or_donation_effort
1035529895206477824,Guys its #100PipersPlayForACause by @100PipersIN bringing together some of the most celebrated names in music to contribute to Kerala flood relief.,rescue_volunteering_or_donation_effort
1037045220121223168,This is Kerala Education Minister C Raveendranath carrying relief material on his shoulders. Happens only in Kerala. #KeralaFloods,other_relevant_information
1030411544964689921,"RT @EBCNEWSONLINE: #KeralaFloods death toll reached 106 with nearly 150,000 left homeless",injured_or_dead_people
1032194180200718336,If youre in Kerala and your course books are lost or damaged please DM / Text Message the details of the books along with your address Ill courier the same. You can also email me at baldiankit@gmail.com #KeralaFloods #KeralaRains #KeralaFloodRelief #HelpTheGovernment,infrastructure_and_utility_damage
1031297413812695040,My prayers are with all those affected and innocent lives lost. May there be a continued rescue effort and re-building of lives from this tragic disaster. #KeralaFloodRescue,sympathy_and_support
1031045983906422784,@urstrulyMahesh A Man With Golden Heart 25Laks Donated For #KeralaFloods #SuperStar Ὁ6Ὁ6Ὁ6ὠDὠDὠDὤFὤFὤF #KeralaFloodRelief #StandWithKerala #KeralaFloodRescue,rescue_volunteering_or_donation_effort
1030822313896202240,"I will donate ₹5 per RT for #KeralaFloods in the next 12 hours. Let’s help our great State of india, i am from East India and i work in kerala past 2 years, its my duty to save my mother Indias land and great Peoples Spread the word. #KeralaDonationChallenge #Donate4Kerala",rescue_volunteering_or_donation_effort
1031072012863598596,@SunnyLeone has donated 5 Crores to Kerala Flood Relief FundὠD !! Great Respect to this ladyὄD❤️ !! Love you MamὉ6 !! #SunnyLeone #KeralaReliefFund #KeralaRainsHelp,rescue_volunteering_or_donation_effort
1032908840981786625,The Presstitutes are so silent about UAE clarification on ₹700 Cr aid. Theyve denied now. Who are all ready to commit sucide now?,rescue_volunteering_or_donation_effort
1031107120412774400,#BREAKING : Sharad Pawar to sell his private city Lavasa &amp; will donate all the money to Kerala flood affected people #KeralaFloods,rescue_volunteering_or_donation_effort
1032170777108336645,"Indian Railways has restored all affected tracks, normal Rail traffic is being restored from today ➡️  #KeralaFloodRelief",other_relevant_information
1036487790530199552,RT @ndtv: Kerala minister warns tough action over faulty flood damage assessment,other_relevant_information
1037274046121926658,"Our team of skilled workers consisting of plumbers, electricians, technicians and snake catchers are in #Kerala extending the helping hand to the flood affected regions. #KIITForKerala #KeralaReliefWork #KIIT #Kerala",rescue_volunteering_or_donation_effort
1030405478604361729,"At least 13 people feared killed in landslides at Cheruthoni and surrounding areas, near Idukki dam #keralafloods @IndianExpress",injured_or_dead_people
1031738611241107456,RT @BangloreNTRFans: Telugu Paper article about Our Support Towards #KeralaFlood Relief. @tarak9999 @smkoneru @PrVpr,sympathy_and_support
1030755554300313600,My friends family stuck on terrace since 2 days grandma is 98 years old and there are 2 kids 2 years and 8 years old.. along with 9 adults. They need help desperately as the water levels are raising. #KeralaFloods #helpneeded #savekerla,requests_or_urgent_needs
1035847718352998400,All thanks to ONGC for helping affected people of kerala. Well done. #ONGCForKerala,sympathy_and_support
1033263141214248962,"Some of the worst affected areas from landslide where maximum damage is done. Houses needs to be renovated as early as possible #KeralaFloods To lend your support, please visit",infrastructure_and_utility_damage
1036705873324781568,Three water purification units that can provide 700 litres of clean water every hour have been installed by @IndianRedCross. The third one was set up in Kottayam Districts Thiruvarpu Village. Over 500 families and 1200 students will benefit from this. #KeralaFlood #Sanitation,rescue_volunteering_or_donation_effort
1035364911927328768,Relief fund donation to Kerala CM reaches 1000 Cr. Thank you for all your love and concern. #KeralaFloodRelief #CMReliefFund,rescue_volunteering_or_donation_effort
1031107105909092353,Today when you see @RahulGandhi blaming central govt about Kerala flood disasterask him how Govt ruled by UPA acted? He was in foreign nation enjoying holidays n few hundred trucks with relief material were held for RahulGs return and flagoff.,other_relevant_information
1031080712164786177,RT @BurgerrB: Please take Uber and help #Kerala and #Coorg Thanks for the info @sowmyarao_,sympathy_and_support
1036603705620086784,RT @ramindersays: Indian state battles rat fever outbreak after worst floods in a century | Reuters  #PublicHealth,other_relevant_information
1030723765204705282,Called and verified that more volunteers are needed at uc college aluva #keralafloods,rescue_volunteering_or_donation_effort
1038056951375175680,"#RF distributed 19 dry ration kits in Govt. Higher Secondary School, Kallarkutty, 29 dry ration kits in 11 ward Pipeline, Vellathooval, and 14 dry ration kits in Poopana Vipanana Kendram, Konnathady, in the Idukki district. #RFForKerala #KeralaFloods",rescue_volunteering_or_donation_effort
1031034020119961600,"Plz #prayforkerala &amp; #donateforkerala .. . Kerala need yr help &amp; support. Over lakhs of peoples suffering from floods, Rain &amp; landslides. Lets pray for safety of everyone in Kerala. ὤFὤFὤFὤF #keralafloodrelief #standwithkerala #PrayForKerala #KeralaFloods",sympathy_and_support
1030736186938015744,Mumbaikars its time to show are support for Kerala share below details for donations @FloodReliefLka #KeralaFloods,rescue_volunteering_or_donation_effort
1030407298965889024,Here’s a look at the Indian Air Force aircraft deployment for the historic flood crisis in the southern state of Kerala. #KeralaSOS.,rescue_volunteering_or_donation_effort
1032491857589100544,"Despite the 100-year old flood, its time for us to gather hope and pray for the betterment of our Gods own country. Let this Onam bring back the richness and prosperity. #Onam #vrfashionate #Onamwithvrfashionate #keralafloods #happy #festival #celebrations #report #happiness",sympathy_and_support
1030830695537565696,"Coca Cola offering to supply up to 2 million bottles of water from their Aluva, Calicut godowns. #verified #KeralaFloodRelief #Calicut #Ernakulam",rescue_volunteering_or_donation_effort
1033979836568457216,Dont eat uncovered/stale food #KeralaFloods @ndmaindia,caution_and_advice
1030779600761053184,RT @puchifying: #KeralaFloodRelief #KeralaFloods #KeralaSOS #resources #food Need urgent!!!,requests_or_urgent_needs
1032219342522339331,Thalapathy vijay donated 70 lakhs #thalapathy #thalapathyvijay #KeralaFloods. #KeralaFloodRelief #KeralaReliefFund. #vijay,rescue_volunteering_or_donation_effort
1030396228805189632,"Need packed food @ kuchapuram St. mathews LP school, kattakada #Trivandrum #KeralaFloodRelief #KeralaFloods",requests_or_urgent_needs
1031067979159498752,All food chains like @swiggy_in @ZomatoIN @UberEats should come forward to deliver food and essentials in flood struck areas. #KeralaFloodRelief #KeralaReliefFund @CMOKerala,rescue_volunteering_or_donation_effort
1030405439920304129,@VishalKOfficial @Suriya_offl @SevenSri @anguvinoth @shiva_jammy @McZilGratoOffl @AryaTrends @A_Happie_Soul @EcrRavi @Aryananthakumar @Ramyakshan @vinodhamurali1 @VishnuMankara Please share max need help #KeralaFloods #Emergency @Karthi_Offl @arya_offl @VijaySethuOffl @niddu9 @Hema_Jammy @anjana @MercyMerlin2 @Caro03Ami @vimalsuccess @A_Happie_Soul @SuriyaNetwork @SuriyaFansClub,requests_or_urgent_needs
1032600513148145664,"As flood waters receded from many parts of the state, the Kerala government has to face the massive task of cleaning houses and public places filled with mud and slush",other_relevant_information
1032274898259869696,"#HealthOfKerala: Maharashtra doctors screen 2,600 patients on their first day #Keralafloods  @moayush @DPrasanthNair @priankask @cspramesh @oommen @Kerala_floods @Mundra08 @sujakrao @CMOMaharashtra @Brijeshbsingh @InfoMumbai @IasAlok",rescue_volunteering_or_donation_effort
1032628721226641408,"Centre’s relief for flood-hit Kerala is Rs 600 cr, less than the cost of 2 new VVIP aircraft for the President, Vice President and Prime Minister #KeralaFloods",not_humanitarian
1030761144884121600,RT @pujarini_sen: India is climate vulnerable. To floods and to droughts. #ActOnClimate #KeralaFloods @greenpeaceindia,other_relevant_information
1032947240329916416,"RT @roopnayandarak: Communist and jihadis saying they do not want help, I hope they stick to their words and do not take any help",not_humanitarian
1035498613328117760,"It will take considerable time&amp; huge amout for rehabilitation of flood affected people of Kerala&amp; restoration of infrastructure.Govt should take steps to restrain further damage to fragaile Western Ghats, besides setting up dam safety&amp;water management authority.#Keralaflood",other_relevant_information
1030740640387219456,"Padmanabhaswamy temple in Keralas thiruvananthapuram is The Richest in India. Hoping, the trust will voluntarily reach out to provide maximum monetary help &amp; assistance to the flood affected regions &amp; the people of #Kerala. ὤFἿD #KeralaFloodRelief #KeralaFloodsHelpNeeded",rescue_volunteering_or_donation_effort
1036854541147357184,RT @yoginisd:  Technology to help Keralas muddy waters to potable water sent by Gujarat.,rescue_volunteering_or_donation_effort
1033255689274060800,@mvmeet @amritabhinder Kerala thanked Army and UAE govt for their assistance. No need to thank #RSSTraitors who were not visible during #KeralaFloods and now doing photo session as publicity stunts. BTW Can Mr.Jailbird on bail confirm why the Honorable PM was Thanking UAE Govt on 18th August?,other_relevant_information
1032219860284203008,"Rain was not the only factor behind #KeralaFloods that killed around 400 people; poor development and abuse of the local environment also played a major part, say experts.",injured_or_dead_people
1034730472771792896,25 lakhs by #NivinPauly towards the #KeralaFloodsRelief Fund..  #KeralaFloods #RebuildKerala,rescue_volunteering_or_donation_effort
1032208398798925824,I request Mr Modi to deposit the 15 lakhs Rs promised by him to me in 2014 to be deposited in Chief Ministers Distress Relief Fund. I also ask my friends to join this challenge. #KeralaFloods #15LakhChallenge #My15LakhsForKerala,rescue_volunteering_or_donation_effort
1036093417829220354,HDFC bank has announced to adopt 30 flood affected villages in Kerala. #KeralaFloods #KeralaFloodRelief,rescue_volunteering_or_donation_effort
1031965164885573633,"@Yusuffali_MA please ensure this please help kerala our home, when center doesnt want us to even have this help from UAE you are the only person we believe who could help us bring this aid home soem how #KeralaFloods #KeralaFloodRelief",sympathy_and_support
1031189615028330499,"The worst flooding in a 100 years in Kerala.Millions of people have been made homeless,&amp; Rs 20,000 crore-worth of damage caused to the state, Please don’t forget to donate via @CMOKeralas site and help us rebuild the gods own country  #KeralaReliefFund",infrastructure_and_utility_damage
1032183342131761152,#KeralaRelief #KeralaFloods Anyone flying down from Delhi to Kerala who can carry 20000 water purification tablets? The courier (@DTDCIndia) picked it up but let it rest at the airport. It was sent out on Saturday. @rimakallingal @AnjaliMenonFilm @dhanyarajendran,rescue_volunteering_or_donation_effort
1032613391238680576,RT @coastaldigest: College boy commits suicide after floods destroy his certificates,not_humanitarian
1030730839657795584,"ANI: Prime Minister Narendra Modi was accompanied by Kerala CM Pinarayi Vijayan, Governor P. Sathasivam and Union Tourism Minister KJ Alphons during aerial survey of flood affected areas. #KeralaFloods",other_relevant_information
1031030067483365376,RT @UttarandhraNow: Center aid to #KeralaReliefFund now 600CRs.,rescue_volunteering_or_donation_effort
1030718737995915264,RT @dilipjain1979: #BREAKING PM @narendramodi has granted Rs 500 crore interim relief to flood-ravaged Kerala. #KeralaFloods #SOSKerala #,rescue_volunteering_or_donation_effort
1036962607062609920,#KeralaFloods #HealthHazard UPDATE: September 4 115 confirmed Leptospirosis cases and 141 suspected cases. Highest till date. 1 confirmed death and 4 suspected deaths. One confirmed Dengue death also reported. @shailajateacher @MoHFW_INDIA @Director_NCDC @US_CDCIndia,injured_or_dead_people
1034078279001677825,"#Maharashtra CM @Dev_Fadnavis , Governor and Cabinet Ministers to donate one days salary for #Kerala flood relief. #KeralaFloods",rescue_volunteering_or_donation_effort
1030400319371366400,I did my part for our fellow Indians . #Kerala #KeralaFloodRelief #KeralaFloods #donate #whatyoucan,rescue_volunteering_or_donation_effort
1034967144427966470,#Sevabharati filed case against Leftist-Jihadi unholy nexus those who have fabricated stories and defamed the organization. #KeralaFloods,other_relevant_information
1032659711638814720,Central assistance to flood affected Kerala,rescue_volunteering_or_donation_effort
1032573235035086849,"RT @DimpleAtra: And without any overt or covert agenda to convert, unlike the proselytising piranhas.",not_humanitarian
1031803289094909953,".@PankajMMunjal gifts cycle to 9-yr-old #Anupriya who donated piggy bank savings to #KeralaFlood victims, promises one every year. @Hero_Cycles #KeralaReliefFund",rescue_volunteering_or_donation_effort
1032340666033090567,"Com sitharam Yechury and MA Baby At Kollam CPIM DC Office,visiting Relief materials collection at Dc office. MV Govindan master and KN Balagopal and party volenteers,with them #KeralaFloods #StandWithKerala",rescue_volunteering_or_donation_effort
1030847778249830400,"RT @UkkenTintu: As per source, water level is decreasing at most places. #KeralaFloodRelief #KeralaFloods",other_relevant_information
1033219267246940160,@RahulGandhi what are you searching in resto ? food packet for #KeralaFloodRelief . how long you fulish to your servants other supportive parties ? Light camera action and drama- ahul-a-Vinci (++὇9὇Aᾒ1 ****** @cgalgale1,not_humanitarian
1031106525056524289,RT @SubodhK_: Water level reducing in Cochin Airport area. Cheers #KeralaFloodRelief,other_relevant_information
1032498503849656321,"Basic health requirements are still in crisis in various parts of the region. Water is not potable even from the wells and cant be use for any purpose. #KeralaFloods To lend your support, please visit",sympathy_and_support
1034366613435416576,RT @aswinjkumarTOI: #KeralaFloods Postal department struggles to tide over crisis,other_relevant_information
1031834569996029954,RT @mittalrag: Are there any collection points in Delhi that are collecting relief material for the #KeralaFlood ?,rescue_volunteering_or_donation_effort
1030822715954024449,Haryana Chief Minister Manohar Lal Khattar today said that the state government would provide financial assistance of Rs 10 crore to flood affected people and for rescue operations in Kerala.,rescue_volunteering_or_donation_effort
1032170711027073024,"@AnilNPillai32 Saranam iyyappa ὤF Any court order, banning liquor sales, since d state is now depending on aids from all over the country/ world, but no shortage of money to buy liquor ὄ7 See d queue, after opening of a liquor shop, in flood affected Kerala.",not_humanitarian
1033779693172875264,"Kerala flood 2018: Aid given is advance, more to follow: PM Modi tells Kerala governor ₹₹₹₹₹ why modi is telling the Governor and not to the CM who is responsible for rehabilitation. Modi is a disgusting PM.",other_relevant_information
1033387164380278784,"People who reside in the northern, western and eastern states of India also came together to donate as much money as possible in their individual capacity for relief and rescue efforts. A calamity of this magnitude should unite Indians together and not divide them. #KeralaFloods",rescue_volunteering_or_donation_effort
1031689216835481600,"Hats off ὄC ὄF@KeerthyOfficial, she donated Rs 10 Lakhs to CM distress relief fund and 5Lakhs towards the purchase of relief materials. #keralafloods #KeralaFloodRelief",rescue_volunteering_or_donation_effort
1030767804658511872,"There are many charities and organisations collecting funds for #KeralaFloodRelief - thanks to everybody who organised / donated, youre all awesome! I personally donated to @CMOKerala s Disaster Relief Fund (CMDRF). Why did I choose CMDRF?",rescue_volunteering_or_donation_effort
1033635444200800256,"#Keralafloods | The Christian community was unable to offer their Sunday Prayers as the church was filled with water. They requested our volunteers to clean the church for the Sunday mass, a volunteer said. @divya5521 reports",sympathy_and_support
1035516738870292481,"@Neha57552553 @itsSSR a person can stay some days without air, some hours without water, some days without food but not a second without a thought. so lets donate food, money and advices #KeralaFloodRelief ὄD",rescue_volunteering_or_donation_effort
1032286927544758272,Its sheer happiness to be a part of the #keralafloods relief goods distribution. My bro along with our friends distributed goods in the flood affected #Pathanamthitta. Thank u all my friends who contributed for this cause. #keralasos #KeralaFloodRelief,rescue_volunteering_or_donation_effort
1032059253077331968,"RT @timesofindia: Sex workers donate Rs 21,000 for #KeralaFlood victims",rescue_volunteering_or_donation_effort
1031744213015121920,#SaveKerala #KeralaFloodRelief @RSSorg Kerala Prant Sanghachalak&amp;Prant Karayavah appeal to the Nation to rise to the occasion by lending your helping hands to the victims of #KeralaFloods Donate generously to #SevaBharati flood relief fund @narendramodi @PMOIndia,sympathy_and_support
1030794250982580226,"#DoForKerala Heres what you can do to help: Log on to  for Chief Ministers Relief Fund details and helpline numbers. Contribute via Paytm, BHIM and Tez. Buy essentials from Amazon or Big Basket and send it to the NGOs working on ground. #KeralaFloods",rescue_volunteering_or_donation_effort
1030846846892208128,"Over 104 people were killed in UP last August and 171 this year, also 170 people in West Bengal, 139 in Maharashtra, 52 people lost their lives in Gujarat, but this imbecile wants to justify the 324+ deaths in Kerala, thats Hindutva for you.",injured_or_dead_people
1033595401977229313,"For the past 6 years, Vishnu from #MadhyaPradesh, has been buying blankets from #Haryana &amp; selling in #Kannur during monsoon Met him yesterday at a #FloodRelief Camp. Said he wanted to give blankets free of cost as main 6 saal se idhar aa raha hoon. Yahaan log bade achhe hain",rescue_volunteering_or_donation_effort
1031079137400651776,"RT @LiberalsOfDelhi: People asking what are liberals of Lutyens donating. Well, we have sent tonnes of thoughts and prayers. #Kerala",sympathy_and_support
1032042916326199298,My driver Zubair just said me: I will not sacrifice Goat tomorrow &amp; instead donate the same amount to Kerala flood victims! He said No to Blood! I urge all our Muslim brother to make this Festival as #BloodlessEid &amp; spread peace &amp; harmony! #EidMubarak #EidAlAdha #EidulAzha,rescue_volunteering_or_donation_effort
1031548530781868033,"As your big Indian Fan, requesting you to please donate for the #KeralaFloods as Kerala needs big help from the big heart people like you sir. Please requesting you to look into this and contribute, your help is must at this time sir. You r a best friend to Indians. @BarackObama",rescue_volunteering_or_donation_effort
1034297101411344384,Stay Safe After Flood! Always stay alert with news updates and reports. #Keralasanghaihum #supportkerala #keralaflood #becareful #SGI #insurance,caution_and_advice
1030413084530114560,Attention all : For Cochin district NH 47 Karukutty  Adlux convention centre is open with water and food available Verified Info. Please spread fast #KeralaFloods,rescue_volunteering_or_donation_effort
1031432942919266304,"Immediately, there must be programmes aiming at rehabilitation of agriculture and the plantation industry. At the same time, drinking water supply should receive overriding priority. Its essential to avoid water borne diseases. #KeralaFloodRelief #KeralaFloods #RebuildKerala",other_relevant_information
1037566870944194560,@Indiamining @GoaFront @goacm @PMOIndia @DrPramodSawant2 @BJP4India @BJP4Goa @mygovindia @TendulkarBJP #mining dependents generously donated towards Kerala Chief Ministers Distress Relief Fund for the noble and humanitarian cause. #GoaMining #KeralaFloodRelief #KeralaFloods,rescue_volunteering_or_donation_effort
1030793655349665792,Personal numbers of people who came with RESCUE BOATS in #Chengannur pleaseὤF SHARE #KeralaFloods #KeralaFloodRelief #Kerala #KeralaSOS #KeralaRescue #Kerala flood #KeralaRain #KeralaFlooding #KeralaFloodReliefs @Actor_Jayasurya @dulQuer @CMOKerala @anbodukochi @AnjaliMenonFilm,rescue_volunteering_or_donation_effort
1030780085303828481,RT @HerHighnessMary: My friend is gathering materials #Thrissur #sanitarynapkins #needed #KeralaFloodRelief,rescue_volunteering_or_donation_effort
